{"workflow_id":"url-summary","name":"URL Summary Workflow","description":"Fetches a web page from a given URL, extracts and cleans its text content, then produces a one-page summary highlighting key points and open questions.","agents":[{"id":"page-fetcher","stage":"fetch","description":"Fetches the page at the given URL and extracts clean, readable text content, stripping HTML markup, navigation, ads, and other boilerplate.","depends_on":[]},{"id":"summary-writer","stage":"summarize","description":"Reads the cleaned page text and writes a one-page summary that includes key points and a list of open questions raised by the content.","depends_on":["fetch"]}]}
